Final_Score,Title,Publication Year,Cited by Patent Count,NPL Citation Count,Simple Family Size,AI_Human_Abstract,AI_Keywords,AI_Use_Cases,AI_Market_Potential,Google_Trends_Score,Google_Trends_Keyword,Google_Trends_Direction,Google_Trends_Avg_Interest,Unlocked_Comment,Abstract,URL
0.7549111197920779,Thermal cycler for automatic performance of the polymerase chain reaction with close temperature control,1995,634,78,89,"Toto je zariadenie na presné testovanie DNA pomocou PCR technológie, ktoré dokáže spracovať veľa vzoriek naraz v špeciálnych plastových miskách. Má pokročilé riadenie teploty a softvér, čo umožňuje spoľahlivé a automatické analýzy genetického materiálu.","PCR machine, DNA testing equipment, genetic analyzer, laboratory automation, molecular diagnostics",Lekárske laboratóriá na diagnostiku chorôb a genetické testy | Forenzné laboratóriá na analýzu DNA z miesta činu | Výskumné ústavy na štúdium génov a vývoj liekov,"Stále veľmi relevantné - trh s molekulárnou diagnostikou rastie najmä po COVID-19 pandémii. Veľký globálny trh s miliardovými obratmi, poháňaný personalizovanou medicínou a genetickým testovaním.",0.0,PCR machine,unknown,0.0,,"An instrument for performing highly accurate PCR employing a sample block in microtiter tray format. The sample block has local balance and local symmetry. A three zone film heater controlled by a computer and ramp cooling solenoid valves also controlled by the computer for gating coolant flow through the block controls the block temperature. Constant bias cooling is used for small changes. Sample temperature is calculated instead of measured. A platen deforms plastic caps to apply a minimum acceptable threshold force for seating the tubes and thermally isolates them. A cover isolates the block. The control software includes diagnostics. An install program tests and characterizes the instrument. A new user interface is used. Disposable, multipiece plastic microtiter trays to give individual freedom to sample tubes are taught.",https://lens.org/144-225-956-865-164
0.7284344022516906,Thermal cycler for automatic performance of the polymerase chain reaction with close temperature control,1997,383,75,89,"Toto je presný stroj na kopírovanie DNA pomocou PCR technológie, ktorý dokáže automaticky meniť teplotu vzoriek s vysokou presnosťou. Používa sa na laboratórne testovanie DNA a genetické analýzy, kde je potrebná spoľahlivá a rýchla amplifikácia genetického materiálu.","PCR machine, DNA testing equipment, genetic analyzer, laboratory thermal cycler",Medicínska diagnostika a testovanie genetických chorôb v nemocniciach | Forenzné laboratóriá pre analýzu DNA z miesta činu | Výskumné laboratóriá pre vývoj liekov a biotechnológie,"Stále veľmi relevantné - trh s PCR zariadeniami rastie vďaka personalizovanej medicíne, COVID testovaniu a genetickému výskumu. Ide o miliardový globálny trh s kontinuálnym rastom.",0.2363969465648855,PCR machine,falling,33.770992366412216,,"An instrument for performing highly accurate PCR employing a sample block in microtiter tray format. The sample block has local balance and local symmetry. A three zone film heater controlled by a computer and ramp cooling solenoid valves also controlled by the computer for gating coolant flow through the block controls the block temperature. Constant bias cooling is used for small changes. Sample temperature is calculated instead of measured. A platen deforms plastic caps to apply a minimum acceptable threshold force for seating the tubes and thermally isolates them. A cover isolates the block. The control software includes diagnostics. An install program tests and characterizes the instrument. A new user interface is used. Disposable, multipiece plastic microtiter trays to give individual freedom to sample tubes are taught.",https://lens.org/160-735-605-849-170
0.6717116838264027,System and method of controlling an HVAC system,2006,666,54,25,"Tento systém automaticky riadi klimatizáciu a kúrenie v budovách na základe aktuálnej situácie v elektrickej sieti. Keď je elektrická energia drahá alebo je sieť preťažená, systém dokáže znížiť spotrebu energie bez toho, aby výrazne ovplyvnil komfort ľudí v budove.","smart thermostat, energy management, HVAC control, smart building",Automatické riadenie klimatizácie v kancelárskych budovách počas špičkových hodín | Znižovanie nákladov na energie v obchodných centrách pomocou inteligentného riadenia kúrenia | Optimalizácia spotreby energie v priemyselných halách na základe cien elektriny,Stále veľmi relevantné s rastúcim trhom smart buildings a potrebou energetickej efektívnosti. Trh inteligentných budov rastie ročne o 10-15% a táto technológia je súčasťou hlavného trendu.,0.0,smart thermostat,unknown,0.0,,A system and method manage delivery of energy from a distribution network to one or more sites. Each site has at least one device coupled to the distribution network. The at least one device controllably consumes energy. The system includes a node and a control system. The node is coupled to the at least one device for sensing and controlling energy delivered to the device. A control system is coupled to the node and distribution network for delivery to the node at least one characteristic of the distribution network. The node controls the supply of energy to the device as a function of the at least one characteristic.,https://lens.org/077-390-671-687-246
0.6693587839862138,Controller interface with multiple day programming,2006,478,99,17,"Táto technológia umožňuje ľuďom jednoducho naprogramovať zariadenia na celý týždeň naraz, namiesto programovania každého dňa zvlášť. Šetrí čas tým, že môžete vybrať viacero dní súčasne a nastaviť im rovnaký rozvrh cez užívateľsky prívetivé menu.","weekly programming, smart thermostat, schedule controller, home automation, programmable timer",Programovanie inteligentných termostatov na rôzne teploty počas pracovných dní vs. víkendov | Nastavenie zavlažovacích systémov záhrad s rôznymi rozvrhy pre rôzne dni v týždni | Ovládanie osvetlenia v komerčných budovách s flexibilnými hodinami prevádzky,"Stále veľmi relevantné v rastúcom trhu smart home a IoT zariadení. Veľký trh s kontinuálnym rastom, keďže ľudia čoraz více automatizujú svoje domácnosti a kancelárie.",0.0,weekly programming,unknown,0.0,,"A controller equipped with a user interface having multiple-day programming capabilities, including methods of programming such devices, are disclosed. The user interface may include one or more menus or screens that can be used to program a schedule for one or more selected days during the week. An illustrative method of programming the controller may include the steps of entering a scheduling routine, selecting multiple days for schedule modification, changing the schedule parameters for one or more periods during the selected days, and then exiting the scheduling routine.",https://lens.org/117-429-207-626-233
0.6606195886189681,Environmental condition control and energy management system and method,2001,949,63,12,"Tento systém automaticky upravuje kúrenie a klimatizáciu v budovách na základe aktuálnych cien elektriny, čím šetrí peniaze. Keď je elektrina drahá, systém trochu zníži komfort (napríklad zvýši teplotu o pár stupňov v lete), a keď je lacná, udržuje ideálne podmienky.","smart thermostat, energy saving, electricity cost, home automation, HVAC control",Inteligentné termostaty pre domácnosti s variabilnými tarifami elektriny | Energetický manažment vo veľkých kancelárskych budovách a obchodných centrách | Automatizácia klimatizácie v skladoch a výrobných halách na zníženie prevádzkových nákladov,Stále veľmi relevantné s rastúcim trhom - smart home technológie a energetická efektívnosť sú hlavné trendy. Trh inteligentných termostatov rastie ročne o 20%+ a regulácie EÚ tlačia na energetické úspory.,0.0,smart thermostat,unknown,0.0,,"An indoor environmental condition control and energy management system includes a plurality of inputs. A user input receives user input parameters including a desired indoor environmental condition range for at least one energy unit price point. An indoor environmental condition input receives a sensed indoor environmental condition. An energy price input receives a schedule of projected energy unit prices per time periods. A processor, coupled to the inputs, computes an environmental condition deadband range for multiple energy unit price points based on the user input parameters and controls at least one energy-consuming load device to maintain the indoor environmental condition within the computed deadband range for a then-current energy unit price point. In an embodiment, the environmental condition includes at least temperature and the at least one load device includes a heating and cooling system. The processor, in one embodiment, communicates through a communications link with at least one energy supply company and selects one energy supply company for a premise to minimize energy consumption cost.",https://lens.org/156-889-107-198-448
